"DESCRIPTION","DURATION IN MS","NAME","PARENT SUITE","START TIME","STATUS","STOP TIME","SUB SUITE","SUITE","TEST CLASS","TEST METHOD"
"","10127","The comment is not posted under the product","chromium","Fri Mar 28 18:42:58 GMT 2025","failed","Fri Mar 28 18:43:08 GMT 2025","Crash","test.spec.js","",""
"","9067","The product quantity can not be encreased","chromium","Fri Mar 28 18:43:09 GMT 2025","passed","Fri Mar 28 18:43:18 GMT 2025","Functional","test.spec.js","",""
"","2302","The selected number of results is not desplayed","chromium","Fri Mar 28 18:42:36 GMT 2025","passed","Fri Mar 28 18:42:38 GMT 2025","Crash","test.spec.js","",""
"","4813","The manufacturer link does not show an appropriate page","chromium","Fri Mar 28 18:43:18 GMT 2025","passed","Fri Mar 28 18:43:23 GMT 2025","Functional","test.spec.js","",""
"","4724","The product image fills the box entirely just like all other product images","chromium","Fri Mar 28 18:42:31 GMT 2025","passed","Fri Mar 28 18:42:36 GMT 2025","Visual","test.spec.js","",""
"","6149","The twitter share button should show an appropriate page to share the product on Twitter","chromium","Fri Mar 28 18:43:23 GMT 2025","passed","Fri Mar 28 18:43:29 GMT 2025","Functional","test.spec.js","",""
